ID;Text;SDG_1;SDG_2;SDG_3;SDG_4;SDG_5;SDG_6;SDG_7;SDG_8;SDG_9;SDG_10;SDG_11;SDG_12;SDG_13;SDG_14;SDG_15;SDG_16;SDG_17_
1;1.1 By 2030, eradicate extreme poverty for all people everywhere, currently measured as people living on less than $1.25 a day;1;;;;;;;;;;;;;;;;
2;1.2 By 2030, reduce at least by half the proportion of men, women and children of all ages living in poverty in all its dimensions according to national definitions;1;;;;;;;;;;;;;;;;
3;1.3 Implement nationally appropriate social protection systems and measures for all, including floors, and by 2030 achieve substantial coverage of the poor and the vulnerable;1;;;;;;;;;;;;;;;;
4;1.4 By 2030, ensure that all men and women, in particular the poor and the vulnerable, have equal rights to economic resources, as well as access to basic services, ownership and control over land and other forms of property, inheritance, natural resources, appropriate new technology and financial services, including microfinance;1;;;;;;;;;;;;;;;;
5;1.5 By 2030, build the resilience of the poor and those in vulnerable situations and reduce their exposure and vulnerability to climate-related extreme events and other economic, social and environmental shocks and disasters;1;;;;;;;;;;;;;;;;
6;1.a Ensure significant mobilization of resources from a variety of sources, including through enhanced development cooperation, in order to provide adequate and predictable means for developing countries, in particular least developed countries, to implement programmes and policies to end poverty in all its dimensions;1;;;;;;;;;;;;;;;;
7;1.b Create sound policy frameworks at the national, regional and international levels, based on pro-poor and gender-sensitive development strategies, to support accelerated investment in poverty eradication actions;1;;;;;;;;;;;;;;;;
8;The share of the world population living in extreme poverty declined to 10 per cent in 2015, down from 16 per cent in 2010 and 36 per cent in 1990. However, the pace of poverty reduction is decelerating, with a “nowcast” of 8.6 per cent in 2018. Moreover, baseline projections suggest that 6 per cent of the world population will still be living in extreme poverty in 2030, missing the target of ending poverty.;1;;;;;;;;;;;;;;;;
9;Despite having a job, 8 per cent of the world’s workers and their families still lived in extreme poverty in 2018. The situation remains particularly alarming in sub-Saharan Africa, where the share of working poor stood at 38 per cent in 2018.;1;;;;;;;;;;;;;;;;
10;Social protection systems help prevent and reduce poverty and provide a safety net for the vulnerable. However, social protection is not a reality for a large majority of the world’s population. In 2016, 55 per cent – as many as 4 billion people – were not covered by any social protection cash benefits, with large variations across regions: from 87 per cent without coverage in sub-Saharan Africa to 14 per cent in Europe and Northern America.;1;;;;;;;;;;;;;;;;
11;Only 22 per cent of unemployed persons receive unemployment cash benefits, only 28 per cent of persons with severe disabilities receive disability cash benefits, only 35 per cent of children worldwide enjoy effective access to social protection and only 41 per cent of women giving birth receive maternity cash benefits.;1;;;;;;;;;;;;;;;;
12;Disasters often lead to a downturn in the trajectory of socioeconomic development and exacerbate poverty. From 1998 to 2017, direct economic losses from disasters were estimated at almost $3 trillion, of which climate - related disasters accounted for 77 per cent of the total – a rise of 151 per cent compared with the period from 1978 to 1997 – and climate-related and geophysical disasters claimed an estimated 1.3 million lives. More than 90 per cent of deaths reported internationally were due to disaster events in low- and middle-income countries, and economic losses from disasters as a percentage of gross domestic product (GDP) were also much higher in these countries.;1;;;;;;;;;;;;;;;;
13;The rate of extreme poverty has fallen rapidly: in 2013 it was a third of the 1990 value. The latest global estimate suggests that 11 per cent of the world population, or 783 million people, lived below the extreme poverty threshold in 2013.;1;;;;;;;;;;;;;;;;
14;The proportion of the world’s workers living with their families on less than $1.90 per person a day declined significantly over the past two decades, falling from 26.9 per cent in 2000 to 9.2 per cent in 2017.;1;;;;;;;;;;;;;;;;
15;Based on 2016 estimates, only 45 per cent of the world’s population were effectively covered by at least one social protection cash benefit.;1;;;;;;;;;;;;;;;;
16;an estimated 767 million people lived below the international poverty line of $1.90 a day — down from 1.7 billion people in 1999. That figure reflects a decrease in the global poverty rate from 28 per cent in 1999 to 11 per cent in 2013. The most significant progress was seen in Eastern and SouthEastern Asia, where the rate declined from 35 per cent in 1999 to 3 per cent in 2013. In contrast, 42 per cent of people in sub-Saharan Africa continued to subsist in conditions of extreme poverty in 2013.;1;;;;;;;;;;;;;;;;
17;Social protection systems are fundamental to preventing and reducing poverty and inequality at every stage of people’s lives, through benefits for children, mothers with newborns, persons with disabilities, older persons and thoses persons who are poor and without jobs. Preliminary data show that in 2016, only 45 per cent of the world’s population was effectively protected by a social protection system and that coverage varied widely across countries and regions.;1;;;;;;;;;;;;;;;;
18;Poverty is not  having enough material possessions or income for a person's needs.  Poverty may include social, economic, and political elements.\nAbsolute poverty is the complete lack of the means necessary to meet basic personal needs, such as food, clothing, and shelter.  The threshold at which absolute poverty is defined is always about the same, independent of the person's permanent location or era.\nOn the other hand, relative poverty occurs when a person cannot meet a minimum level of living standards, compared to others in the same time and place. Therefore, the threshold at which relative poverty is defined varies from one country to another, or from one society to another.  For example, a person who cannot afford housing better than a small tent in an open field would be said to live in relative poverty if almost everyone else in that area lives in modern brick homes, but not if everyone else also lives in small tents in open fields (for example, in a nomadic tribe).\nGovernments and non-governmental organizations try to reduce poverty.  Providing basic needs to people who are unable to earn a sufficient income can be hampered by constraints on government's ability to deliver services, such as corruption, tax avoidance, debt and loan conditionalities and by the brain drain of health care and educational professionals. Strategies of increasing income to make basic needs more affordable typically include welfare, economic freedoms and providing financial services.;1;;;;;;;;;;;;;;;;
19;The objective of Sustainable Development Goal 1 is to end to poverty in all its manifestations, including extreme poverty, over the next 15 years beginning in 2016. All people everywhere, including the poorest and most vulnerable, should enjoy a basic standard of living and the benefits of adequate social protection. Indeed, eradicating poverty remains one of the greatest global challenges today, hence the continued focus on this overarching goal in the 2030 Agenda and in Agenda 2063.;1;;;;;;;;;;;;;;;;
20;Experience with urban social assistance programmes is still limited. Many of the existing urban programmes are extensions or duplicates of rural programmes, but urban-sensitive social protection needs to reflect the distinct vulnerabilities of the urban poor. Furthermore, applying a child lens requires identifying and addressing the specific risks and multiple deprivations that are experienced by half of urban children in developing countries. As a result, designing social assistance for urban contexts faces challenges such as accurately targeting the poor (given the spatial geography of urban poverty) and setting appropriate payment levels (given the high and variable costs of urban living). Geographic targeting (e.g. informal settlements), proxy means testing (if urban-sensitive) and categorical targeting (e.g. street children) are popular mechanisms in urban areas, but community-based targeting is often inappropriate (because of urban social fragmentation) while self-targeting can be unethical (e.g. where wages below market rates are paid in public works projects) and might contradict rights-based approaches. These are relevant challenges to address when designing urban social protection programmes. We apply these reflections to Ghana. The country is a relevant case study because it is growing and urbanizing rapidly. But as the result of urbanization, urban poverty and deprivations are rising even though national poverty rates have halved. Anti-poverty policies and social protection interventions remain biased towards the rural poor. The ‘urbanization of poverty’ in Ghana has created problems such as overcrowded housing, limited access to sanitation, and outbreaks of communicable diseases. This paper provides guidance on the critical questions to ask to design in Ghana a successful urban social protection programme with a child lens.;1;;;;;;;;;;;;;;;;
21;This paper provides an overview of the main trends in child income poverty since the mid-2000s, and explores to what extent child poverty trends are linked to demographic, policy and/or labour market changes. Trends in poverty and the standard of living of children in low-income families since the onset of the Great Recession are also closely examined: nearly 1 in 7 children is income-poor in the OECD, and child poverty increased in almost two/thirds of OECD countries with the Great Recession. About 1 in 10 children across the OECD live in a family with a standard of living below the 2005 poverty line. Children in low-income families experienced a decline in their standard of living in many countries, with the largest decline among families with the smallest incomes.;1;;;;;;;;;;;;;;;;
22;Eradicating extreme poverty is at the centre of all international development efforts. Since 2000, the United Nations has embedded the goal of eradicating extreme hunger and poverty in the first of the Millennium Development Goals (MDG). Likewise, ending poverty in all its forms and dimensions is the first of the Sustainable Development Goals (SDG) and an integral part of the entire 2030 Agenda for Sustainable Development.;1;;;;;;;;;;;;;;;;
23;signing Agenda 2030, Governments around the world committed to ending poverty in all its manifestations, including its most extreme forms, over the next 15 years. They resolved that all people everywhere should enjoy a basic standard of living. This includes social protection benefits for the poor and most vulnerable and ensuring that people harmed by conflict and natural hazards receive adequate support, including access to basic services.;1;;;;;;;;;;;;;;;;
24;We use panel data for Brazilian states from 1995 to 2009 to analyse the impact of economic growth and income inequality on poverty change in Brazil, seeking to evaluate the Bourguignon (2003) hypothesis that the more unequal a country is, the less effective economic growth will be at reducing poverty. To this end, we estimate poverty elasticities relative to income and inequality, specifying two dynamic econometric models estimated via the generalized method of moments (GMM) system developed by Arellano and Bond (1991), Arellano and Bover (1995) and Blundell and Bond (1998). The model-estimated results prompt the conclusion that the income growth effect on poverty reduction is smaller when the initial development level is low. The same is found when the initial inequality level is high. Therefore, regions with a low initial development level, high initial inequality or both present less favourable conditions for reducing poverty through income growth.;1;;;;;;;;;;;;;;;;
25;"In this edition of the Social Panorama of Latin America, the Economic Commission for Latin America and the Caribbean (ECLAC) provides an update on the magnitude and trends of poverty and related factors. Section A of this chapter analyses the evolution of poverty and extreme poverty since 2002, and it reviews recent trends in both indicators in the individual countries, based on the corresponding national estimates. Section B then describes how poverty has affected certain population groups depending on gender, age and area of residence. It then examines some of the factors driving poverty trends and analyses the impact of changes in average household income and its distribution and the changes observed in the different components of income in households in situations of poverty. In keeping with the central theme of this edition of the Social Panorama of Latin America, section D analyses the sufficiency of labour income and pensions as multiples of the poverty line; and it also reviews the effects of the levels of each type of income on the situation of poverty and extreme poverty. The chapter closes with a brief methodological annex on updating ECLAC poverty estimates.";1;;;;;;;;;;;;;;;;
26;No one is more vulnerable to poverty than children. Poverty perpetuates the cycle of disadvantage and inequity, which robs millions of children of their potential and causes irreparable damage that reverberates throughout a lifetime. Putting children at the heart of poverty reduction is one of the best ways to break that cycle and create a level playing field for every child.;1;;;;;;;;;;;;;;;;
27;The paper provides an examination of the relevance of ethics to poverty reduction. Ethics examines the nature and scope of institutions as the deepest level of analysis. The ethics of poverty is understood as the principles and processes of justification employed to justify assisting people in poverty. The paper argues that ethical perspectives are relevant to understanding poverty and the priority given to poverty reduction in society. It further argues that ethical perspectives inform the design and scope of anti-poverty programmes. Drawing on the recent expansion of social assistance in Brazil, South Africa and Ghana, the paper shows that ethical perspectives are relevant to our understanding of the evolution of anti-poverty policy.;1;;;;;;;;;;;;;;;;
28;Social protection is at the centre of Ethiopia’s development policy. It is instrumental in reducing poverty and increasing the resilience of the population. The Government of Ethiopia (GoE) has published a new set of policy frameworks for social protection that envisage the expansion of social protection to cover a greater proportion of Ethiopians against a broader range of risks, and that call for social protection to be increasingly financed from domestic sources rather than by donors. A financing strategy for the implementation of this vision has been identified as a priority by the GoE. This study responds to this requirement. It provides a comprehensive mapping of social protection spending across the five focus areas of the national social protection policy and analyses the fiscal space available for different spending scenarios up to 2025/26. The study focuses on two issues in particular: the role of donor financing for social protection and the relationship between humanitarian relief and social protection spending.;1;;;;;;;;;;;;;;;;
29;Poverty is a result of economic imbalances whereby the poor are unable to secure decent jobs or deliver their produce to markets, and social depravations whereby they lack access to basic public services, such as education, health, drinking water, sanitation and electricity. This multidimensionality of poverty undermines human development on multiple fronts.;1;;;;;;;;;;;;;;;;
30;This chapter provides a forward-looking assessment of risk and vulnerability in Cambodia. While monetary poverty has fallen rapidly since the early 2000s and inequality has also declined, a large population is vulnerable to falling back into poverty. The analysis demonstrated that deprivation levels have not declined as quickly as monetary poverty. Climate change, large-scale internal and international migration, rapid urbanisation and changes to the age structure of the population are likely to determine demand for social protection over the longer term. The extent to which Cambodia is able to diversify its economy will also be a critical factor.;1;;;;;;;;;;;;;;;;
31;Employment is pivotal to strengthening the economic recovery, increasing social welfare and redressing poverty. Jobs are returning, making inroads into high unemployment, but their wages and skill levels are lower than many that were lost during the crisis. Greece’s hiring is benefiting from more flexible arrangements. Legislative amendments can maintain this flexibility, ensure wages align with productivity and better protect individuals from labour market risks. Ensuring that workers possess skills that match employers’ needs will sustain employment and productivity growth. Improving the education system is a long-term mission and involves raising its pedagogical strength and orientation towards professional needs. A social welfare system dominated by pensions has not been able to prevent a steep hike in poverty among children and the young, risking long-term harm to well-being. Pursuing recent steps towards a better targeted social protection, accompanied by support programmes for jobseekers, will provide a reliable safety net and reduce poverty.;1;;;;;;;;;;;;;;;;
32;While the monetary approach highlights the relevance of income and consumption to measuring poverty, the capability and social exclusion approaches stress the importance of other dimensions that characterize non-monetary poverty.;1;;;;;;;;;;;;;;;;
33;This paper compares the situation of children in Korea relative to other OECD countries in terms of child poverty and well-being. First, trends in child poverty and living standards are described. An overview of key internationally available indicators of child well-being is also provided. The paper discusses the observed poverty trends in relation to social protection programs and to policies implemented to support families. Some priorities for action to make the alleviation of child poverty more effective are discussed.;1;;;;;;;;;;;;;;;;
34;or decades poverty eradication has been a global development goal and for many countries a national policy priority. The adoption of the 2030 Agenda for Sustainable Development by the United Nations General Assembly on 25 September 2015 has further raised the level of ambition and increased the scope for monitoring poverty around the world. As stated in the Preamble to the Agenda, “…eradicating poverty in all its forms and dimensions, including extreme poverty, is the greatest global challenge and an indispensable requirement for sustainable development.”;1;;;;;;;;;;;;;;;;
35;"The extent to which income inequality and poverty vary within countries across different regions is very relevant for policy decisions and monitoring. However, sub-national measures are scarce, given the complexity of producing indicators at the regional level from the available data and the methodological issues related to cross-countries comparability. This paper presents a set of indicators of income inequality and poverty across and within regions for 28 OECD countries. These indicators were produced through a new household-level data collection based on internationally harmonized income definitions undertaken as part of the OECD project on “Measuring regional and local well-being for policymaking”. The data were collected at the OECD TL2 territorial level, corresponding to NUTS2 regions in Europe and to large administrative subdivisions (e.g. States in Mexico and Unites States) for non-European countries.
These estimates confirm that there are significant variations in levels of income inequality within countries, and that regional breakdowns are useful for understanding sources and patterns of income disparities and poverty. For most of the countries relying on survey data for measuring income distribution, standard cross-sectional indicators of income inequality and relative poverty at this regional level are estimated with low precision in the smallest regions due to small samples. This has two main implications for data producers and analysts. First, systematic reporting of confidence intervals is needed to make meaningful comparisons of inequality levels across regions and with respect to the national averages. Second, averaged measures for multiple years or small area estimation methods should be considered as means for obtaining more robust measures. The issues related to the estimation of standard errors for three-year averages in rotational panel surveys and to the definition of the computational sampling structure for sub-national estimates are discussed in the paper.";1;;;;;;;;;;;;;;;;
36;"This study analyses the impact of economic growth and income inequality on poverty in Brazil in the years from 1981 to 2013. A dynamic panel model was used, estimated by the twostep generalized method-of-moments system developed by Blundell-Bond (1998), in order to analyse three scenarios: the first corresponds to the entire period covered by this study (i.e. 1981-2013); the second encompasses the years from 1981 to 1994 (the period leading up to the Real Plan); and the third is the period from 1995 to 2013 (the years following the implementation of the Real Plan). The results indicate that economic growth policies that promote an increase in income in conjunction with a reduction in income disparities are more effective in combating poverty in Brazil than those that focus only on raising mean income levels. The findings also point to the existence of a pro-poor form of growth in the period following the Real Plan.";1;;;;;;;;;;;;;;;;
37;This chapter uses information available as of 2014 to set out the current situation of Latin America regarding poverty and income distribution. According to ECLAC estimates, average poverty and indigence rates did not alter significantly in the region as a whole between 2012 and 2014, which raises doubts about the prospects for progress in these areas over the coming years, given the current economic environment. However, examination of the figures for the individual countries shows that a number of these did make progress in reducing poverty and indigence indicators, while others experienced reverses in the same period.;1;;;;;;;;;;;;;;;;
38;"Poverty Eradication Action
Vulnerable Population Groups
End Poverty
Enhanced Development Cooperation
Social Assistance
Social Assistance Programmes
Poverty Rate
Sound Policy Framework
Social Safety Net
Social Protection Systems
Poverty Eradication
Poverty Levels
Extreme Poverty
Social Protection Mechanisms";1;;;;;;;;;;;;;;;;
39;"Livelihood Empowerment Against Poverty
Urban Poverty Reduction
Social Protection
Urban Poor
Inclusive Urbanisation
Social Assistance Programmes
Child Poverty
Multidimensional Child Poverty
Social Protection Programmes
Social Assistance
Urban Poverty
Rural Areas
Social Protection Systems";1;;;;;;;;;;;;;;;;
40;"Child Poverty Rates
Relative Child Poverty Rate
Child Poverty
Poor Children
Relative Child Poverty
Reducing Child Poverty
Poverty Rate
Jobless Families
Poverty Line
Low Income Families
Poor Families";1;;;;;;;;;;;;;;;;
41;"Social Transfers In Kind
Absolute Poverty Line
Transfers In Kind
Poverty Line
Food Poverty Line
Poverty Measures
Relative Poverty Line
Relative Poverty
Poverty Statistics
Welfare Measures
Minimum Subsistence
Poverty Indicators
National Poverty Line
Poverty Gap
Absolute Poverty
International Poverty Line";1;;;;;;;;;;;;;;;;
42;"International Poverty Line
Poverty Line
Absolute Poverty Line
End Poverty
Poverty Gap
Extreme Poverty Line
National Poverty Line
Vulnerable Population Groups
Extreme Poverty
";1;;;;;;;;;;;;;;;;
43;"
End Poverty
Social Protection Benefits
Social Protection Systems
Social Protection
Social Protection Programmes
Cash Transfers
Extreme Poverty
Social Insurance
Labour Market Programmes
Basic Standards
Wage Subsidies
Basic Services
Social Assistance
Economic And Social Development
Poor Countries";1;;;;;;;;;;;;;;;;
44;"Extreme Poverty
Social Protection
End Poverty
Disasters
sub-Saharan Africa
Social Protection Benefits
Social Protection Systems
Poverty Rate
Rural Areas
Social Protection Schemes";1;;;;;;;;;;;;;;;;
45;"Extreme Poverty Rate
Poverty Rate
Extreme Poverty
Average Household Income
Extreme Poverty Levels
Poverty Line
Poverty Indicators
Poverty Rate Increased";1;;;;;;;;;;;;;;;;
46;"Multidimensional Poverty Index
Multidimensional Poverty
Relative Deprivation
Poverty Measures
Deprivation
Monetary Poverty
Extreme Poverty Line
Absolute Poverty Line
Poverty Line
Material Living Standards
Income Poverty
Material Deprivation";1;;;;;;;;;;;;;;;;
47;"Income Inequality
Income Poverty
Poverty Reduction
Poverty Line
Income Distribution

";1;;;;;;;;;;;;;;;;
48;"Child Poverty
Material Deprivation
Poor Children
Child Poverty Rates
Reducing Child Poverty
Low Income Families";1;;;;;;;;;;;;;;;;
49;"Extreme Poverty Rate
Poverty Line
Extreme Poverty
Poverty Rate
Poverty Measures
Income Poverty Measures
Extreme Poverty Levels
Average Household Income
Poverty Reduction Policies
Social Protection Systems";1;;;;;;;;;;;;;;;;
