ID;Text;SDG_1;SDG_2;SDG_3;SDG_4;SDG_5;SDG_6;SDG_7;SDG_8;SDG_9;SDG_10;SDG_11;SDG_12;SDG_13;SDG_14;SDG_15;SDG_16;SDG_17_
964;Ocean acidification is closely linked to shifts in the carbonate chemistry of the waters, which can lead to a significant weakening of the shells and skeletons of many marine species (such as reef-building corals and shelled molluscs).;;;;;;;;;;;;;;1;;;
965;A nautical mile is a unit of measurement used in air, marine, and space navigation, and for the definition of territorial waters. Historically, it was defined as one minute (1/60 of a degree) of latitude along any line of longitude. Today the international nautical mile is defined as exactly 1852 metres (about 1.15 miles). The derived unit of speed is the knot, one nautical mile per hour;;;;;;;;;;;;;;1;;;
966;Maritime history is the study of human interaction with and activity at sea. It covers a broad thematic element of history that often uses a global approach, although national and regional histories remain predominant. As an academic subject, it often crosses the boundaries of standard disciplines, focusing on understanding humankind's various relationships to the oceans, seas, and major waterways of the globe. Nautical history records and interprets past events involving ships, shipping, navigation, and seafarers.Maritime history is the broad overarching subject that includes fishing, whaling, international maritime law, naval history, the history of ships, ship design, shipbuilding, the history of navigation, the history of the various maritime-related sciences (oceanography, cartography, hydrography, etc.), sea exploration, maritime economics and trade, shipping, yachting, seaside resorts, the history of lighthouses and aids to navigation, maritime themes in literature, maritime themes in art, the social history of sailors and passengers and sea-related communities.  There are a number of approaches to the field, sometimes divided into two broad categories: Traditionalists, who seek to engage a small audience of other academics, and Utilitarians, who seek to influence policy makers and a wider audience.;;;;;;;;;;;;;;1;;;
967;Marine debris, also known as marine litter, is human-created waste that has deliberately or accidentally been released in a sea or ocean. Floating oceanic debris tends to accumulate at the center of gyres and on coastlines, frequently washing aground, when it is known as beach litter or tidewrack. Deliberate disposal of wastes at sea is called ocean dumping. Naturally occurring debris, such as driftwood, are also present.\nWith the increasing use of plastic, human influence has become an issue as many types of (petrochemical) plastics do not biodegrade. Waterborne plastic poses a serious threat to fish, seabirds, marine reptiles, and marine mammals, as well as to boats and coasts. Dumping, container spillages, litter washed into storm drains and waterways and wind-blown landfill waste all contribute to this problem.\nIn efforts to prevent and mediate marine debris and pollutants, laws and policies have been adopted internationally. Depending on relevance to the issues and various levels of contribution, some countries have introduced more specified protection policies;;;;;;;;;;;;;;1;;;
968;Marine pollution occurs when harmful effects result from the entry into the ocean of chemicals, particles, industrial, agricultural and residential waste, noise, or the spread of invasive organisms. Eighty percent of marine pollution comes from land. Air pollution is also a contributing factor by carrying off pesticides or dirt into the ocean. Land and air pollution have proven to be harmful to marine life and its habitats.The pollution often comes from nonpoint sources such as agricultural runoff, wind-blown debris, and dust. Pollution in large bodies of water can be aggravated by physical phenomena like the biological effects of Langmuir circulation. Nutrient pollution, a form of water pollution, refers to contamination by excessive inputs of nutrients. It is a primary cause of eutrophication of surface waters, in which excess nutrients, usually nitrates or phosphates, stimulate algae growth. Many potentially toxic chemicals adhere to tiny particles which are then taken up by plankton and benthic animals, most of which are either deposit feeders or filter feeders. In this way, the toxins are concentrated upward within ocean food chains. Many particles combine chemically in a manner highly depletive of oxygen, causing estuaries to become anoxic.\nWhen pesticides are incorporated into the marine ecosystem, they quickly become absorbed into marine food webs. Once in the food webs, these pesticides can cause mutations, as well as diseases, which can be harmful to humans as well as the entire food web. Toxic metals can also be introduced into marine food webs. These can cause a change to tissue matter, biochemistry, behaviour, reproduction, and suppress growth in marine life. Also, many animal feeds have a high fish meal or fish hydrolysate content. In this way, marine toxins can be transferred to land animals, and appear later in meat and dairy products.\nIn order to protect the ocean from marine pollution, policies have been developed internationally. There are different ways for the ocean to get polluted, therefore there have been multiple laws, policies, and treaties put into place throughout history.;;;;;;;;;;;;;;1;;;
969;Marine life, or sea life or ocean life, is the plants, animals and other organisms that live in the salt water of the sea or ocean, or the brackish water of coastal estuaries. At a fundamental level, marine life affects the nature of the planet. Marine organisms produce oxygen and sequester carbon. Shorelines are in part shaped and protected by marine life, and some marine organisms even help create new land. The term marine comes from the Latin mare, meaning sea or ocean.\nMost life forms evolved initially in marine habitats. By volume, oceans provide about 90 percent of the living space on the planet. The earliest vertebrates appeared in the form of fish, which live exclusively in water. Some of these evolved into amphibians which spend portions of their lives in water and portions on land. Other fish evolved into land mammals and subsequently returned to the ocean as seals, dolphins or whales. Plant forms such as kelp and algae grow in the water and are the basis for some underwater ecosystems. Plankton forms the general foundation of the ocean food chain, particularly the phytoplankton which are key primary producers.\nMarine invertebrates exhibit a wide range of modifications to survive in poorly oxygenated waters, including breathing tubes as in mollusc siphons. Fish have gills instead of lungs, although some species of fish, such as the lungfish, have both. Marine mammals, such as dolphins, whales, otters, and seals need to surface periodically to breathe air.\nThere are over 200,000 documented marine species with perhaps two million marine species yet to be documented. Marine species range in size from the microscopic, including phytoplankton which can be as small as 0.02 micrometres, to huge cetaceans (whales, dolphins and porpoises), including the blue whale – the largest known animal reaching 33 metres (108 ft) in length. Marine microorganisms, including protists, bacteria and viruses, constitute about 70% of the total marine biomass.;;;;;;;;;;;;;;1;;;
970;"The coast, also known as the coastline or seashore, is defined as the area where land meets the sea or ocean, or as a line that forms the boundary between the land and the ocean or a lake. Around  620,000 kilometres (390,000 mi) of coastline are on Earth. Because of the coastline paradox, a coastline's exact perimeter cannot be determined. \nThe term coastal zone is used to refer to a region where interactions of sea and land processes occur. Both the terms coast and coastal are often used to describe a geographic location or region located on a coastline (e.g., New Zealand's West Coast, or the East and West Coasts of the United States).\nThe term pelagic coast refers to a coast that fronts on the open ocean, as opposed to a more sheltered coast in a gulf or bay. A shore, on the other hand, can refer to parts of land adjoining any large body of water, including oceans (seashore) and lakes (lake shore). Similarly, the somewhat related term stream bed or stream bank refers to the land alongside or sloping down to a river (riverbank) or body of water smaller than a lake. Bank is also used in some parts of the world to refer to an artificial ridge of earth intended to retain the water of a river or pond; in other places this may be called a levee.\nWhile there is general agreement in the scientific community regarding the definition of a coast, in the political sphere, the delineation of the extents of a coast differ according to jurisdiction. Government authorities in various countries may define coast differently for economic and social policy reasons. According to the UN atlas, 44% of all people live within 150 km (93 mi) of the sea";;;;;;;;;;;;;;1;;;
971;"This paper maps interrelationships among targets of the Sustainable Development Goal dedicated to oceans (SDG 14), as well as interrelationships between those targets and other SDGs. This is done using a large number of UN reports as well as scientific publications. The literature identifies many linkages among the targets of SDG 14; most of these targets are potentially synergistic with one another. Many linkages also exist between SDG 14 targets and other SDGs. Different targets under SDG 14 link to different SDGs. This has implications for policy discussions on how to achieve progress on SDG 14. The interrelationships that we highlight can be used as a tool for dialogue between policy and scientific communities working on oceans, in particular for assessing the status of knowledge on the various linkages, as well as identifying linkages that are likely to matter most for progress on SDG 14.";;;;;;;;;;;;;;1;;;
972;The Ocean is in dire need of our help. If the cycle of decline, in which it is currently caught, is allowed to continue, the deleterious impacts on the life-forms dwelling in, above and next to the Ocean may well become irreversible.;;;;;;;;;;;;;;1;;;
973;This issue of Commonwealth Trade Hot Topics examines the need for special and differential treatment (S&DT) in a potential fisheries agreement at the WTO from the point of view of the socio-economic needs of Small Island Developing States (SIDS) in the Pacific region and current proposals on S&DT in fisheries.;;;;;;;;;;;;;;1;;;
974;Sustainable Development Goal 14, to conserve and sustainably use the oceans, seas and marine resources for sustainable development, is aimed at promoting the conservation and sustainable use of marine and coastal ecosystems, preventing marine pollution and increasing the economic benefits to small island developing States and the least developed countries from the sustainable use of marine resources.;;;;;;;;;;;;;;1;;;
975;This report evaluates the risk of vulnerable marine ecosystems (VMEs) in Arctic and sub-Arctic waters to bottom trawling. It is based on an exhaustive compilation of data on the distribution of VME indicator species, including published and unpublished data, and new data gathered during the project from areas where information is sparse. An overview of the approaches and methodologies for mapping of VME distribution is presented. Eleven VMEs are identified based on management goals for coral and sponge communities present in the study area.;;;;;;;;;;;;;;1;;;
976;In 2014, the United Nations commemorated the twentieth anniversary of the entry into force of the United Nations Convention on the Law of the Sea. During the year, the Organization continued to promote universal acceptance of the Convention and its two implementing Agreements on the implementation of Part XI of the Convention and on the conservation and management of straddling fish stocks and highly migratory fish stocks, respectively.;;;;;;;;;;;;;;1;;;
977;This chapter provides an overview of the mid-term strategy (2017–2020) towards the sustainability of Mediterranean and Black Sea fisheries (“mid-term strategy”), launched by the GFCM in 2016 in order to define a course of decisive action aimed at reverting the alarming trend in the status of commercially exploited stocks in its area of application. The rationale leading to the development of the mid-term strategy as well as its targets and objectives are presented, together with the progress achieved and the challenges and opportunities faced during the first phase of implementation.;;;;;;;;;;;;;;1;;;
978;Oceans cover almost three quarters of the planet, comprising the largest ecosystem on Earth. Large coastal populations in every region depend on them for their livelihoods and prosperity. Oceans also provide priceless environmental services: they generate half the oxygen we breathe, support a wealth of marine resources and act as a climate regulator. Yet despite their critical importance, the mounting impacts of climate change (including ocean acidification), overfishing and marine pollution are jeopardizing progress in protecting the world’s oceans. Small island developing States are the most threatened. Due to the transboundary nature of oceans, marine resource management requires interventions at all levels (national, regional and global) to mitigate threats.;;;;;;;;;;;;;;1;;;
979;Although small states' total share of global trade has been declining over time, specific sectors, including those related to the ocean economy, have been experiencing growth. A number of Commonwealth coastal small states have been pioneering blue economy approaches underpinned by integrated ocean governance frameworks. This International Trade Working Paper explores the associations between improvements in ocean governance – with a focus on fisheries – and Sustainable Development Goal (SDG) 14 trade-related outcomes. It draws on three Commonwealth case studies: Barbados, Belize and Seychelles. The preliminary analysis undertaken suggests that improvements in ocean governance through enhanced coastal protection could boost trade by US$3 million a year on average for Commonwealth small states. Boosting Commonwealth small states coastal protection so that it exceeds the global average could increase the value of fisheries trade for member countries by an average of US$10 million annually. These initial exploratory results provide a number of avenues for further research, including the ocean economy and trade strategies being pioneered in selected Commonwealth small states.;;;;;;;;;;;;;;1;;;
980;Biodiversity has declined rapidly over the last 50 years, with severe implications for human health and well-being, societal resilience and sustainable development. This chapter summarises the international policy context for the conservation and sustainable use of biodiversity. Drawing on a range of data and indicators, it outlines the main pressures on biodiversity globally, and examines trends in the state of terrestrial, marine and freshwater biodiversity.;;;;;;;;;;;;;;1;;;
981;Small-scale fisheries are deeply rooted in the fabric of Mediterranean and Black Sea fishing communities. Their significant role in this region is well known, despite, in some cases, limited available data for this sector. Since millennia, the small-scale fishing sector has supported livelihoods within coastal communities. The role it plays in sustaining economic activity and ensuring food security within vulnerable coastal communities is not to be overlooked, particularly in the current context of ever-increasing rural to urban migration. Furthermore, SSF play a key role in maintaining local traditions and culture, creating added value for other sectors, such as the restaurant and tourism industries.;;;;;;;;;;;;;;1;;;
982;"This chapter provides an overview of the trends in the state of, and pressures on, marine biodiversity; the economic values associated with marine ecosystems; and the types of policy instruments that are available for the conservation and sustainable use of marine biodiversity. It then discusses the role of marine protected areas and summarises their current use and trends. Drawing on the key findings from the publication, the chapter concludes with good practice insights for more effective design and implementation of marine protected areas.";;;;;;;;;;;;;;1;;;
983;Regional fisheries management organisations (RFMOs) are the primary mechanism for co-operation between fishing countries and coastal states to ensure sustainable fishing globally. This paper aims to inspire and guide RFMO secretariats and member countries in how to focus their effort and investment to step up the contribution of RFMOs to the fight against illegal, unreported and unregulated (IUU) fishing. It does so by measuring the extent to which RFMOs apply best practices against IUU fishing and pointing to the remaining gaps. Information gathered from RFMOs’ resolutions and recommendations introducing conservation and management measures (CMMs), other publicly available sources and direct communication with RFMOs’ secretariats was analysed and summarised into five indicators reflecting the most important management tools targeting IUU fishing at the disposal of RFMOs. Indicators show overall progress among RFMOs, but discrepancies remain, suggesting scope for improvement by learning from best performers.;;;;;;;;;;;;;;1;;;
984;Oceans, seas and coastal areas form an integrated and essential component of the Earth’s ecosystem and are critical to sustainable development. They cover more than two thirds of the Earth’s surface and contain 97 per cent of the planet’s water. Oceans contribute to poverty eradication by providing opportunities for sustainable livelihoods and decent work. Over 3 billion people depend on marine and coastal resources as a means of support. In addition, oceans play a crucial role in the achievement of global food security, as well as human health and well-being. They are the primary regulator of the global climate, function as an important sink for greenhouse gases, serve as the host for huge reservoirs of biodiversity and play a major role in producing the oxygen we breathe.;;;;;;;;;;;;;;1;;;
985;This chapter explores how fisheries and aquaculture policies in Indonesia can contribute to improved food security and nutrition. It takes stock of the challenges to food security in Indonesia, describes how fisheries and aquaculture contribute to nutritious food supplies and incomes, and outlines the strategy of the Government of Indonesia for the sector. Policies currently in place are then analysed, and alternative policy options are proposed, where relevant, in light of three main objectives: sustainable management of natural resources for the future, increased economic opportunities for fishers and aqua-farmers, and improved consumer access to seafood.;;;;;;;;;;;;;;1;;;
986;Several countries have been setting up strategic roadmaps to support marine biotechnologies that could drive innovation and help address the global sustainability goals of food, energy, and health. The report identifies and begins to address challenges facing cooperation on marine biotechnology across countries. First, the report provides on an international definition of marine biotechnology that was developed through a multi-year process. Second, the report reviews the international infrastructure in marine biotechnology and identifies the lack of standardisation as a critical issue.;;;;;;;;;;;;;;1;;;
987;It was midnight on 14 December 2016, when five fishermen in Tombo village near Freetown in Sierra Leone revved up a small outboard engine and powered their boat far out to sea. They threw in their net and soon bagged a good quantity of fish. But as they hauled in their catch, a terrible storm blew in. When the waters finally calmed, one of them, an 18-year-old named Alimamy, could not be found.;;;;;;;;;;;;;;1;;;
988;The discussion on improving disciplines on fisheries subsidies and making a contribution towards sustainable fishing and managing global fisheries has been ongoing at the World Trade Organization (WTO) since the WTO Doha Ministerial Conference held in 2001. In 2005, the WTO Hong Kong Ministerial Declaration gave a mandate on negotiations on fisheries subsidies aimed at strengthening disciplines on fisheries subsidies and prohibiting certain forms of subsidies that lead to overcapacity and over-fishing. Small vulnerable economies (SVEs) have strongly been involved in these discussions, particularly in view of the implications for their economies of the threat of certain forms of fisheries subsidies to the sustainability of fishing. Negotiations on fisheries subsidies have intensified as WTO members seek an outcome at the 11th Ministerial Conference (MC11). To participate meaningfully in the negotiations, SVEs have to identify issues of interest to them and ensure that they are captured in the outcome at MC11. This briefing paper assesses the current proposals on the negotiating table to determine whether or not they take into account the interests of SVEs. It concludes by suggesting strategic options on how SVEs can structure approaches to negotiations on strengthening disciplines on subsidies in the fisheries sector.;;;;;;;;;;;;;;1;;;
989;Oceans, seas and other marine resources are essential to human well-being and social and economic development worldwide. Their conservation and sustainable use are central to achieving the 2030 Agenda, especially for small island developing States. Marine resources are particularly important for people living in coastal communities, who represented 37 per cent of the world population in 2010. Oceans provide livelihoods, subsistence and benefits from fisheries, tourism and other sectors. They also help regulate the global ecosystem by absorbing heat and carbon dioxide (CO2) from the atmosphere. However, oceans and coastal areas are extremely vulnerable to environmental degradation, overfishing, climate change and pollution;;;;;;;;;;;;;;1;;;
990;The OECD Fisheries Support Estimate (FSE) database collects and classifies information on budgetary transfers to the fisheries sector in 31 countries that together account for 35% of global fisheries landings. In 2015, the most recent year, it inventories policies and programmes totalling USD 7 billion. Most of this support is found to be directed towards general services to the fishing sector, mainly in the form of fisheries management costs, but also for, inter alia, infrastructure, research and stock enhancement. Approximately USD 500 million per year is used for programmes that deliver funds directly in the hands of fishers. The share of this form of support has been decreasing over time. Payments based on the use of variable inputs are found to be the most likely to provoke increased fishing effort, while payments based on fixed capital formation are most likely to encourage increased capacity levels. Payments based on fishers income are less likely to increase effort or capacity and may be more effective at improving the welfare of fishers. Payments to general services for the sector are least likely to increase effort or fishing capacity.;;;;;;;;;;;;;;1;;;
991;This paper identifies the progress achieved by individual countries in implementing internationally recognised best policies and practices against illegal, unreported and unregulated (IUU) fishing since 2005. It aims to inspire and guide governments and all stakeholders in the fisheries sector in how to focus their effort and investment to step up their fight against IUU fishing. The paper builds on a suite of policy indicators that investigate the extent to which countries meet their responsibilities in the most important dimensions of government intervention in relation to IUU fishing. The indicators show considerable improvement in fighting IUU fishing over the last decade, in line with international treaties and voluntary agreements. They also point to the gaps that need to be closed to individually and collectively work towards eliminating IUU fishing.;;;;;;;;;;;;;;1;;;
992;2017 HLPF Thematic review of SDG 14: Conserve and sustainably use the oceans, seas and marine resources for sustainable development1 SDG 14 is dedicated to humanity’s interactions with the oceans. It covers a range of issues in the area of conservation and sustainable use, with seven targets and three means of implementation to respond to the urgent need for transformative change toward more sustainable practices. Oceans cover around 71% of the Earth's surface and perform a vital regulatory function in the global weather and climate systems. Even the livelihoods and lifestyles of people living far inland often depend directly on rainfall and temperature patterns moderated by distant oceans. SDG 14 recognises the environmental, economic and social benefits that healthy oceans provide, and that resources and services 2 are being eroded by a range of anthropogenic pressures that are potentially manageable and within the SDG14’s scope to improve.;;;;;;;;;;;;;;1;;;
993;"
Coastal Ecosystems
Marine Technology
Destructive Fishing
Fisheries Subsidies
Artisanal Fishers
Ocean Acidification";;;;;;;;;;;;;;1;;;
994;"
Marine Protected Areas
Fisheries Subsidies
Ocean Acidification
Fisheries
Small Scale Fisheries
Small Scale Fishers
Marine Biotechnology
Coastal Ecosystems
Marine Ecosystems
Marine Resources
Fish Stocks
Restore Fish Stocks
Marine Pollution
Marine Litter

";;;;;;;;;;;;;;1;;;
995;"
Destructive Fishing Practices
Ocean Acidification
Marine Pollution
Unregulated Fishing
Coastal Ecosystems
Fish Stocks
Overfishing
Fishing
Marine Conservation
Marine Resources

";;;;;;;;;;;;;;1;;;
